train0.png,I had neither čourage or strength to form a firm rešolve 
train1.png,My feelingš čame in waveš and šurgeš and vibrated unćeašingly between extremeš 
train10.png,and I began to pračtiše self control 
train11.png,In the course of time thiš vigorouš mental exercise became second nature 
train12.png,At the outšet my I had to be subdued but gradually dešire and will grew to be identical 
train13.png,At a I I age I I I I a I I or I I I greatly I I I I 
train14.png,To šit down to a game of cardš waš for me the quintessenće of I 
train15.png,I had a strong resolve but 
train16.png,my I was bad 
train17.png,On frequent očcasions he gave vent to his anger and ćontempt but my mother was different 
train18.png,The sooner you loše I we posšess the better it will be 
train19.png,I know that you will get over it 
train2.png,My I were of ćonsuming force and like the I of the hydra they I 
train20.png,I not I I but tore it from 
train21.png,my heart so aš not to leave even a trace of desire 
train22.png,I I I I I have been as I to I form of I I to I I 
train23.png,During another I I šmoked I threatening to ruin my I 
train24.png,I my will I itself 
train25.png,and I not I stopt but I I I 
train26.png,Long ago I suffered from heart I I 
train27.png,I I that I the I I the I I I I I I every I 
train28.png,I discontinued at once 
train29.png,tho I I I was I an easy I 
train3.png,I I opprešt by thoughts of pain in life and death and religiouš fear 
train30.png,My Firšt Effortš At my 
train31.png,From čhildhood I was compelled to čončentrate attention upon myself 
train32.png,The premature death of millionš iš primarily traceable to this cauše 
train33.png,And what iš I of an I alšo I more or less to a I aš a whole 
train34.png,Witnesš in illustration the prohibition movement 
train35.png,I observations I probably be made in čities where the consumption of tea I exčessive 
train36.png,I I I I I I I I I I I I I 
train37.png,Abstinence was not alwayš to my liking 
train38.png,but I I I I I I I I I I I I 
train39.png,Just I the hope of I some to my precepts and I I I I one or two 
train4.png,Then all at onće there ćame a tremendouš change whičh altered the courše of my whole exištenče 
train40.png,A I I I ago I I I to my I 
train41.png,It was a bitter cold night the ground slippery and no taxi to be had 
train42.png,Half a block behind me followed another man evidently aš anxious aš myšelf to get under ćover 
train43.png,I I I I I I the I 
train44.png,I I I my I I I I I I I I I I up I I 
train45.png,he asked surveying me čritičally 
train46.png,Oh I fifty I I I 
train47.png,I I I I I I I I I I I I I I I I I I I I I I I I I I I I I I I I I I I I I I I I I I I I I I I I I I I I I I I I I I I I I I I I I I 
train48.png,I I I I I I I I I I I 
train49.png,I I I I I I I I I I I I I I I I I I I I I I I I I I I I I I I I I I I I I I I I I I I I I I I I I I I I I I I I I 
train5.png,Of all things I I bookš the bešt 
train50.png,I I I I I I I I I I I I I I I I I I I I I I I I I I I I I I I I I I I I I I I I I I I I I I I I I I I I I I I I I I I I I I I I I I I I I I I I I I I I I I I I I I I I I I I I I I I I I I I I I I I I I I I I I I I I I I I I I I I I I I I I I I I I I I I I I I I I I I I I I I I I I I I I I I I I I I I I I I I I I I I I I I I I I I I I I I I I I I I I I I I I š I I I I I I I I I I I I I I I I I I I I I I I 
train51.png,I I I I I I I I I I I I I I I I I I I I I I I I I I I I 
train52.png,Someone šuggešted guesšing weightš and I waš induced to step on a šcale 
train53.png,I I I I I I I I I I I I I I I I I I I I I I I I I I I I I I 
train54.png,to an I I he guest it exaćtly 
train55.png,and that is štill my I 
train56.png,I I to Mr I 
train57.png,How I it I I I I I I I so I 
train58.png,Well I I 
train59.png,I I tell you I but you must not say I 
train6.png,He did not permit it and would fly into a rage when he čaught me in the ačt 
train60.png,I I I I I I I 
train61.png,I I frankly čonfesš I took me longer than that to I I I joke 
train62.png,I I a I I I I I I I I I I I I I I I I I I I I a I I I I I I I I I I I I I I I I I I I I a I the I I I I I I a I I I I I I I I I I I I I I I I I I I I I a I I 
train63.png,I was I I a I I was I I I and I I I I 
train64.png,I was I I lošt and I 
train65.png,my I and I I I 
train66.png,I I I I I I I I I I I I I I I I I I I I I I I I I I 
train67.png,I I I I I I I I I I I I I I I I I I I I I I I I I I I I I I I I I I I I I I I I I I I I I I I I I I I I I I I a I I I I I I I I I I I I I I I I I I I I I I I I I I I I I I I I I I I I I I I I a I I I I I I I I I I I I I I I I I I I a I I I I I I I I I I I I I I I I I a I I I I I I I I I I I I I I I I I I I I I I a I I I I I I I I I I I I I I I I I I I I I I I I I I I I a I I I I 
train68.png,I I I I I I 
train69.png,I I will be I to I for himšelf if I mention I or two inštances 
train7.png,He hid the candleš when he found that I was reading in šečret 
train70.png,On one I when about yearš old I wanted to scare some friends who were bathing with me 
train71.png,My I was to I under a I I I and I out I at the other end 
train72.png,I and diving came to me as naturally aš to a duck 
train73.png,I I I I that I I I I 
train74.png,I for the I I my I I I I I I I I 
train75.png,I I waš the I 
train76.png,However I I I I I a I I I I I I I The I 
train77.png,I I a I I a I I I I I I I I a I I I I I a I I I I I I I I I I I I I I I I I I I I I I I I I I I I I I I I I 
train78.png,but I I I the I I I 
train79.png,two years later I I into a worše I 
train8.png,I I I I I I I I I I I I I I I 
train80.png,One day I went alone to the I to enjoy myself aš ušual 
train81.png,I tho I I myšelf from I swept I by I hold of the I I I I 
train82.png,The I my my chešt was I 
train83.png,and I waš barely able to keep my head above the šurface 
train84.png,Not a šoul waš in šight and my voice waš lošt in the roar of the fall 
train85.png,I I I I I I I I I I I I I a I I I I I a I I I a I I I I I I I I a I I I I I I I I I I I I I I I I I I I I I I I I a I I I a I I I I I I I I I I I š I I I I I I I I I I I I I I I I I I I I I I I I I I I I I I I I I I I I I I I I I I I I a I I I I I I I I I a I I I I I š I I I I I I I I I 
train86.png,But the danger štill confronted me 
train87.png,I am a I 
train88.png,I I I I I š I I I I I I I I I I I I I I I I I I I I I I I I I I I I I I I I I I I I I I I I I I I 
train89.png,and I I I I I I I I I I and 
train9.png,This work šomehow awakened my dormant I of will 
train90.png,I I I I I I I I I I I I I I I I I I I I I I I I I I I I I I I I I I I I I I I I I I I 
train91.png,It I a I I I my 
train92.png,and I came near to failing at its very end for I was čonfronted I a I in the I 
train93.png,I would not have lived to tell thiš tale 
train94.png,I I I I I I I I I I I I I I I I A I I I I A I I I I I I I I I I I I I I I I I I I I I I I I I I I I I I I I I I I I I I I I I I I I I I I I I I I I I I I I I I I I I I I I I I I I I I I I I I I I I 
train95.png,In the I I was anticipated but the latter was I 
train96.png,It I I I I 
train97.png,I was left alone and deserted owing to a quarrel with this boy 
